59	Justice Involvement	j2c	Driving under the influence/intoxicated arrests	Number of arrests for driving under the influence or while intoxicated	integer	False			Number of arrests for driving under the influence or while intoxicated	
60	Justice Involvement	j2d	Drug activity arrests	Number of arrests for possession, dealing, distribution or sale of drugs	integer	False			Number of arrests for possession, dealing, distribution or sale of drugs	
61	Justice Involvement	j2e	Vandalism or property destruction arrests	Number of arrests for vandalism or property destruction	integer	False			Number of arrests for vandalism or property destruction	
62	Justice Involvement	j2f	Stolen goods arrests	Number of arrests for receiving, possessing or selling stolen goods	integer	False			Number of arrests for receiving, possessing or selling stolen goods	
63	Justice Involvement	j2g	Forgery, fraud or embezzlement arrests	Number of arrests for forgery, fraud or embezzlement	integer	False			Number of arrests for forgery, fraud or embezzlement	
64	Justice Involvement	j2h	Shoplifting arrests	Number of arrests for shoplifting	integer	False			Number of arrests for shoplifting	
65	Justice Involvement	j2i	Theft/larceny arrests	Number of arrests for larceny or theft	integer	False			Number of arrests for larceny or theft	
66	Justice Involvement	j2j	Burglary or breaking and entering arrests	Number of arrests for burglary or breaking and entering	integer	False			Number of arrests for burglary or breaking and entering	
67	Justice Involvement	j2k	Vehicle theft arrests	Number of arrests for motor vehicle theft	integer	False			Number of arrests for motor vehicle theft	
68	Justice Involvement	j2l	Car jacking arrests	Number of arrests for car jacking	integer	False			Number of arrests for car jacking	
69	Justice Involvement	j2m	Simple assault or battery arrests	Number of arrests for simple assault or battery	integer	False			Number of arrests for simple assault or battery	
70	Justice Involvement	j2n	Robbery arrests	Number of arrests for robbery	integer	False			Number of arrests for robbery	
71	Justice Involvement	j2o	Aggravated assault or battery arrests	Number of arrests for aggravated assault or battery	integer	False			Number of arrests for aggravated assault or battery	
72	Justice Involvement	j2p	Forcible rape arrests	Number of arrests for forcible rape	integer	False			Number of arrests for forcible rape	
73	Justice Involvement	j2q	Negligent manslaughter arrests	Number of arrests for murder, homicide or non-negligent manslaughter	integer	False			Number of arrests for murder, homicide or non-negligent manslaughter	
74	Justice Involvement	j2r	Arson arrests	Number of arrests for arson	integer	False			Number of arrests for arson	
75	Justice Involvement	j2s	Commercialized sex arrests	Number of arrests for prostitution, pimping or commercialized sex	integer	False			Number of arrests for prostitution, pimping or commercialized sex	
76	Justice Involvement	j2t	Other charges arrests	Number of arrests for other charges (carrying a weapon, gang involvement, domestic violence, trespass, gambling, disturbing the peace, disorderly conduct, paraphernalia, runaway, curfew, truancy)	integer	False			Number of arrests for other charges (carrying a weapon, gang involvement, domestic violence, trespass, gambling, disturbing the peace, disorderly conduct, paraphernalia, runaway, curfew, truancy)	
77	Justice Involvement	j3a	Electronic monitoring	Number of days person has been on electronic monitoring	integer	True			During the past 90 days (since last assessment), how many days have you been  on electronic monitoring?	
78	Justice Involvement	j3b	House arrest	Number of days a person has been on house arrest	integer	True			During the past 90 days (since last assessment), how many days have you been  on house arrest?	
79	Justice Involvement	j3c	Jail time	Number of days a person has been in jail	integer	True			During the past 90 days (since last assessment), how many days have you been  in jail?	
80	Justice Involvement	j3d	Prison time	Number of days a person has been in prison	integer	True			During the past 90 days (since last assessment), how many days have you been  in prison?	
81	Justice Involvement	j3e	Current jail or prison	Person is currently in jail or prison	string	True		['Yes', 'No', 'Unknown']	Are you currently in jail or prison? (CAN MARK IF OBVIOUS)	MBK: added Unknown to satisfy a small amount of respondents for one hub.
82	Justice Involvement	j3f	Length of jail or prison time	Length of jail or prison time for this episode	integer	True			How long have you been in jail or prison? (just this episode)	
83	Justice Involvement	j4a	Parole	Number of days a person has been on parole	integer	True			During the past 90 days (since last assessment), how many days have you been on parole?	
84	Justice Involvement	j4b	Probation	Number of days a person has been on probation	integer	True			During the past 90 days (since last assessment), how many days have you been on probation?	
85	Justice Involvement	j4c	Other kind of community supervision	Number of days a person has been on any other kind of community supervision	integer	True			During the past 90 days (since last assessment), how many days have you been on any other kind of community supervision?	
86	Justice Involvement	j4d	Meeting with probation or parole officer	Number of days a person has met with a probation or parole officer	integer	True			During the past 90 days (since last assessment), how many days have you met with your probation or parole officer?	
87	Justice Involvement	j4e	Trouble with probation or parole officer	Number of days a person has been in trouble with a probation or parole officer	integer	True			During the past 90 days (since last assessment), how many days have you been in trouble with your probation or parole officer?	
88	Justice Involvement	j5a	Life time arrests	Number of days a person has been arrested in their lifetime (including juvenile)	integer	True			During your lifetime, how many times in your life have you been arrested including as a juvenile?	
89	Justice Involvement	j5b	First time arrest	Age at time of first arrest	integer	True			During your lifetime, how old were you the first time you were arrested?	
90	Justice Involvement	j5c_years	Lifetime years in detention, jail, or prison time	Number of times a person has spent in detention, jail or prison during a personr lifetime?	integer	True			During your lifetime, how much total time have you spent in detention, jail or prison during your lifetime?	
91	Justice Involvement	j5c_months	Lifetime months in detention, jail, or prison time	Number of times a person has spent in detention, jail or prison during lifetime	integer	True			During your lifetime, how much total time have you spent in detention, jail or prison during your lifetime?	
92	Justice Involvement	j5d	Lifetime guity and sentenced	Number of times a person has been found guilty and sentenced (including adjudications as a a personth or convictions as an adult)	integer	True			During your lifetime, how many times have you been found guilty and sentenced (including adjudications as a youth or convictions as an adult)?	
93	Justice Involvement	j5e	First time adjudication conviction	Age at which a person was first adjudicated and convicted	integer	True			During your lifetime, how old were you the first time you were adjudicated or convicted?	
