name,title,type,description,trueValues,falseValues,constraints.enum,section,original_name,constraints.required,constraints.maxLength,constraints.pattern,format,notes
jdc_person_id,JCOIN data commons person identifier,string,The generated unique identifier specific to the JCOIN Data Commons for a given individual (client or staff).,,,,Record and linkage,jdc_person_id,True,9,[A-Z][0-9][0-9][0-9]-[0-9][0-9][0-9][0-9],,
quarter_enrolled,Quarter Enrolled,string,The financial quarter and year of enrollment,,,,Enrollment,quarter_enrolled,True,6,[0-9][0-9][0-9][0-9]Q[0-9],,
state_of_site_enrollment,State of Site For Enrollment,string,The U.S. State abbreviation of the site where client (participant) was initially enrolled,,,,Enrollment,state_of_site_enrollment,True,2,[A-Z][A-Z],,
current_study_status,Current Study Status,string,A summary of the current status where client (participant) is in study,,,On study|Dropped out|Withdrawn by investigator|Completed study|Unknown,Enrollment,current_study_status,True,,,,
birth_date,Birth date,date,What is your birth date?,,,,Demographics,d1,,,,%Y%m%d,
age,Age,integer,About how old are you? (top coded at 90),,,,Demographics,d1a,,,,,
sex_at_birth,Sex at birth,string,What sex was originally listed on your birth certificate?,,,Male|Female|Decline to answer|Something else,Demographics,o1,,,,,
gender_id,Gender Identity,string,What is your gender identity?,,,Male|Female|Transgender man/trans man/female-to-male (FTM)|Transgender woman/trans woman/male-to-female (MTF)|Genderqueer/gender nonconforming/neither exclusively male nor female|Additional gender category (or other)|Not reported,Demographics,o2,,,,,"For gender/orientation/identity, use items O1-O2 if possible, otherwise use D4a-D4c.   [Must use one or the other.]
 False if not 'Male' and not 'Transfgender' else True"
gender_id_condensed,Gender Identity (condensed),string,What is your gender identity?,,,Male|Female|Transgender|Gender nonconforming|Something else|Not reported,Demographics,d4b,,,,,"For gender/orientation/identity, use items O1-O2 if possible, otherwise use D4a-D4c.   [Must use one or the other.]"
race_white,Race: White,boolean,[White] What is your race? SELECT ALL THAT APPLY,Yes,No,,Demographics,d3_white,True,,,,
race_black,Race: Black or African American,boolean,[Black or African American] What is your race? SELECT ALL THAT APPLY,Yes,No,,Demographics,d3_black,True,,,,
race_AIAN,Race: American Indian or Alaska Native,boolean,[American Indian or Alaska Native] What is your race? SELECT ALL THAT APPLY,Yes,No,,Demographics,d3_american_indian,True,,,,
race_hawaiian_OPI,Race: Native Hawaiian or Other Pacific Islander,boolean,[Native Hawaiian or Other Pacific Islander] What is your race? SELECT ALL THAT APPLY,Yes,No,,Demographics,d3_hawaiian,True,,,,
race_asian,Race: Asian,boolean,[Asian] What is your race? SELECT ALL THAT APPLY,Yes,No,,Demographics,d3_asian,True,,,,
race_other,Race: Other,boolean,[Other] What is your race? SELECT ALL THAT APPLY,Yes,No,,Demographics,d3_other,True,,,,
race_AI_tribe,Race: American indian principal tribe or community specified,string,[American indian principal tribe or community specified] What is your race? SELECT ALL THAT APPLY,,,,Demographics,d3_specify_tribe,,80,,,
race_other_specified,Race: Other specified,string,[Other specified] What is your race? SELECT ALL THAT APPLY,,,,Demographics,d3_specify_other,,80,,,
hispanic_latino,"Hispanic, Latino, or Spanish Origin",boolean,"Are you of Hispanic, Latino, or Spanish origin?",Yes,No,,Demographics,d2,True,,,,
sex_orient_category,Sexual orientation,string,Sexual orientation:  Do you think of yourself as…,,,"Straight or heterosexual|Lesbian or gay|Bisexual|Queer,pansexual, and/or questioning|Something else",Demographics,d4c,,,,,
sex_orient_other,Sexual orientation:  Other specified,string,Sexual orientation:  Do you think of yourself as…,,,,Demographics,d4c_specify_other,,,,,
ever_pregnant,Ever pregnant,string,Have you ever been pregnant?,,,"Never been pregnant|Currently pregnant|Previously pregnant, had a child|Previously pregnant, did not have a child|Not applicable|Don't know",Demographics,d4d,,,,,"Does this just apply to that past 90 days?  If not, then the participant should be able to check more than one response."
marital_status,Marital status,string,What is your marital status?,,,Married|Widowed|Divorced|Separated|Never married,Demographics,d5,,,,,
living_as_married,Married with partner,string,Are you currently living as married with a romantic partner?,,,"Yes, I am living as married with partner|No, I am not living as married with partner",Demographics,d5a,,,,,
educ_category,Education,string,What is the highest grade or level of school you have completed or the highest degree you have received?,,,"Did not complete high school|GED or equivalent|Regular high school diploma|Some college credit but less than 1 year of college credit|1 or more years of college credit but no degree|Associate's degree (e.g., AA or AS)|Bachelor's degree (e.g.,  BA or BS)|Graduate degree (e.g., MSW, MA, MS, JD, MD, DSW, EdD, PhD)|Other (specify)",Demographics,d6,,,,,
educ_highest_grade,Education:  Highest grade level (if less than GED or h.s. diploma),integer,What is the highest grade completed?,,,,Demographics,d6_grade,,,,,
educ_other_specified,Education: Other specified,string,What is the highest grade or level of school you have completed or the highest degree you have received?,,,,Demographics,d6_specify_other,,,,,
intv_while_incarc,Interviewed during incarceration,boolean,Interview conducted with participant during incarceration?,Yes,No,,MOUD,u14f,,,,,
days_incarcerated_interval,Days incarcerated (in past 30/xx days),integer,"During the past xx/30 days, how many days have you been incarcerated?",,,,MOUD,u14g,,,,,
ever_rx_moud,Medication ever prescribed for opioid use disorder?,boolean,Have you ever been prescribed and taken medication to treat opioid use disorder?  (Illicit use should be excluded.),Yes,No,,MOUD,u15,,,,,
months_daily_bup,Buprenorphine-naloxone or buprenorphine daily sublingual: Lifetime months,integer,"Lifetime months (buprenorphine-naloxone or buprenorphine daily sublingual [e.g., Suboxone film or tablet, generic films or tablets, or Subutex tablets])",,,,MOUD,u15a1,,,,,
months_sublocade,Buprenorphine injection (Sublocade):  Lifetime months,integer,Lifetime months (buprenorphine injection [Sublocade]),,,,MOUD,u15b1,,,,,
months_weekly_brixadi,Buprenorphine  weekly injection (Brixadi):  Lifetime months,integer,Lifetime months (buprenorphine weekly injection [Brixadi]),,,,MOUD,u15c1,,,,,
months_monthly_brixadi,Buprenorphine  monthly injection (Brixadi):  Lifetime months,integer,Lifetime months (buprenorphine monthly injection [Brixadi]),,,,MOUD,u15d1,,,,,
months_probuphine_implant,Buprenorphine 6-month implant (Probuphine):  Lifetime months,integer,Lifetime months (buprenorphine 6-month implant [Probuphine]),,,,MOUD,u15e1,,,,,
months_daily_ntx,Naltrexone daily (oral):  Lifetime months,integer,Lifetime months (Naltrexone daily (oral)),,,,MOUD,u15f1,,,,,
months_monthly_vivitrol,Naltrexone monthly injection (Vivitrol):  Lifetime months,integer,Lifetime months (Naltrexone monthly injection [Vivitrol]),,,,MOUD,u15g1,,,,,
months_methadone,Methadone daily:  Lifetime months,integer,Lifetime months (methadone daily),,,,MOUD,u15h1,,,,,
